{
  "name": "0_Input",
  "encodingFormat": "http://edamontology.org/format_3752",
  "additionalType": "http://edamontology.org/data_3707",
  "description": "Species count. A tabular file with observation data. Must at least contain three columns 'observation.unit' which associate year and location (alternatively, you can have this column split in 2 columns named 'year' and 'location'), 'species.code' with species ID and 'number' for abundance."
}